{
"success": true,
"project": "Weft",
"title": "Public Summary — Weft",
"start_time": "16:00",
"status": "archived",
"content_handling": {
"summarized": false,
"shortened": false,
"instruction": "Full content archived, not summarized and not shortened."
},
"notion": {
"url": "https://notion.example.com/archive-record-placeholder"
}
}
